{
  "schema": "fsgg.coordination.unit-acceptance/1",
  "unitId": "GS2-02.8",
  "state": "accepted",
  "unitContractSha256": "cb4e6fdfe8cceefe255f071b7d54592f5b7c95c960255e9b0f1f37ab64811b69",
  "sourceRevision": "46bf53552061f0dcf653ee8bf381ef28e4c72116",
  "artifacts": [
    {
      "name": "merge-commit",
      "sha256": "57b1c8333feb3462e5eeeee4cba8751e55dcbb29699187bc384af6539c6caa4f"
    }
  ],
  "acceptedAt": "2026-08-28T05:39:21Z",
  "digest": "5743a6d716f6aba612e96664bfd5c1538eaa19eec93808eb41dff36789f39417"
}
