{
  "schema": "fsgg.coordination.unit-acceptance/1",
  "unitId": "GS2-07.7",
  "state": "accepted",
  "unitContractSha256": "9a95bfaea95586912a8906ccd2aaa11f83f0a118839d8fc251333f17d950ecb5",
  "sourceRevision": "32985e9b62a287cb8854dad8da5d1f8561b3a5ee",
  "artifacts": [
    { "name": "accepted-GS2-07.6-receipt", "sha256": "eaf032038cc3ed1fb3f1a21db81a32f7af7969f84a0d9b77cd1d7eea68346bc6" },
    { "name": "event-benefit-contract", "sha256": "2aad0160c09a1b4810c5d7222b301a5f83cdfa837a0b53da6bbf56733a664719" },
    { "name": "observation-declaration", "sha256": "0d99db425a430a68383f992f77e91cc1a47364cf9907caa6a44d31ce18a366fd" },
    { "name": "provider-observation", "sha256": "4db6b0ab1ab32e22186890a988a469fa14c0c8992788fd11ef7d29e3fd9df06b" },
    { "name": "measurement-report", "sha256": "c5215fbfb939475e978044dc45fea3507a7fd853048981f71ad9681c11c6f787" },
    { "name": "generated-controls", "sha256": "dbe9028fd955c685ccc546da70f30391c6356f52edf67ebfb9186e5c5d6469bd" },
    { "name": "independent-controls", "sha256": "fbfcf9751a129bd0d282cfe9db585a49c66c2fd4f0e7c76f5d4bd88017afffca" },
    { "name": "gate-inversion", "sha256": "3af456d498c10fe4f34356136a0b09f6661ea3f87c9789d4fa0055ea25c4eb96" },
    { "name": "unit-full-tests", "sha256": "b89e182d824eb77d2526b747c1573c516e2b148c6718c671149c04e382e82077" },
    { "name": "architecture-focused-tests", "sha256": "ed7dc9351a15b6939b5eae60bde7801487f0938caa86187257a79aa8fdb4579c" },
    { "name": "independent-technical-review", "sha256": "0a5dcc8b031c1768cf39caf75cde3a99db760e21a683ac347801fa64915b468a" },
    { "name": "sdd-evidence", "sha256": "d729f41e803e1fb22deb7bdcfd39220b1c5e9da1c5b4b12cb4260ef9104f2817" },
    { "name": "sdd-ship-verdict", "sha256": "ce72d539b9771b16d2b408f69c6bcfa156e5538c6455894076d33fc134637749" },
    { "name": "feedback-audit", "sha256": "8db3e8917db193a0add18b74ad85bf178090b14fe762b9f48138b0a804cbf806" },
    { "name": "qualification-manifest", "sha256": "66e1614bcbe993feef80f89479b1c265ede90cbb8c090698b8f791d504cc66e1" },
    { "name": "structured-review-pass", "sha256": "19079946803375b6106a44033f70f77534307f566d6bd11d8940a5814b6e8fcb" },
    { "name": "host-acceptance", "sha256": "b645fb12cdad196a6a2a767f8821d442bfc4964ac168e60662d87aa8b2ce7cdf" },
    { "name": "reviewed-head-32985e9b62a287cb8854dad8da5d1f8561b3a5ee", "sha256": "5854bc2a87952a9866b9268ea8e8c8729c9059c1610ceda02c7f9851dbaa4735" },
    { "name": "implementation-merge-a304c739ef3256e4a798ff193afa455885cb20f9", "sha256": "50da0d0fd7fa3030ae31b8fe21d0b49f69c03306203bb6e30b0ac59f42cd824b" },
    { "name": "implementation-bootstrap-run-34185144586", "sha256": "e95e86dda3b9dd73e973f095e59352a540b84c2d8869a487675a974da854d08b" },
    { "name": "implementation-codeql-run-34185142960", "sha256": "c7b60b4a20e76a879f80e0609816006d1bb84e12768273e6e87e401d24e1a1b3" },
    { "name": "protected-main-bootstrap-run-34186030882", "sha256": "5f2d325d93b0334ea7595c6472b18b405b23c48910c6e4d19c54f661363f90be" },
    { "name": "protected-main-codeql-run-34186030416", "sha256": "32d3a00c177b89b62adcadb819c7c9d02c3ccb84c18e3241585b1d2796d2abb0" }
  ],
  "acceptedAt": "2026-09-08T04:18:41Z",
  "digest": "2cd764adfab89480a1272c329a2ed06101766ee92a6be98f76498c5380440e87"
}
