{
  "schema": "fsgg.coordination.unit-acceptance/1",
  "unitId": "GS2-08.9",
  "state": "accepted",
  "unitContractSha256": "c6ca8e280ab1cac9fe19355073b5ab3e92a4d6ff78a83cf63c0689a0d7a52c8f",
  "sourceRevision": "f9e30d7b4a910a618a85099757bd7836864f1028",
  "artifacts": [
    {
      "name": "accepted-GS2-08.8-receipt",
      "sha256": "25856b2453e93087c1ae1ff41fce5b8ce1ed5d81ff2a1434274cddddfa6a429e"
    },
    {
      "name": "residual-writer-sealing-aggregate",
      "sha256": "aa3204f4802deacd7d92541776c4853216e9c02ac796dc1471ae3cc08a6fc036"
    },
    {
      "name": "residual-writer-sealing-validator",
      "sha256": "a0f6641a0ed4a7f5ad31b93cf0f3b67ff64675258a4058f395ab8ef42776281b"
    },
    {
      "name": "residual-writer-sealing-architecture-tests",
      "sha256": "7b9e502fd7cc9aa600579141f4292cf1fc444eb9fbf0ce890001c50b38fea69b"
    },
    {
      "name": "host-helper-retirement-mailbox-evidence",
      "sha256": "fd3b625f5938840d4d63b9a650326799bcabae024ec964a731ab923765112549"
    }
  ],
  "acceptedAt": "2026-09-17T14:19:38Z",
  "digest": "5763daf077fa1eb271bd65fd6a77b0e53b4deee63fcdb44842ca1462a5f3c5f5"
}
