{"schema":"fsgg.coordination.unit-acceptance/1","unitId":"GS2-07.5","state":"accepted","unitContractSha256":"6ad620d58509ce141ee0eda476375b56d610cb150ee4ee089173f339a30ea9f2","sourceRevision":"75373222ccfe50ab73313805f8496edde1dcf482","artifacts":[{"name":"accepted-GS2-07.4-receipt","sha256":"d2cf3b943fc153047652d73de77bfdcb35fe6a087f414a494eec35542edd2a50"},{"name":"owner-item-315","sha256":"95c354fdecf29296f1a8b43968022b922bab41e889c9ab6d514fde0b5450ad24"},{"name":"implementation-pr-316","sha256":"20d104889cc9db61e363c9085344b3f4c171569b4df64a8249f0db51124b214c"},{"name":"merge-group-contract","sha256":"b31d66020b8254a9ebb0c775622b8567aff67db64743db6db2546d0094bfe749"},{"name":"merge-group-generated-controls","sha256":"aed25e2ea5a2ee626b22ec356dc419c623599b50651c78a041e5c396abb32e50"},{"name":"merge-group-independent-controls","sha256":"aff1508e9812097ebdfa9c6f08f8c92a1ffd2f3a5f42625c4631f65f7137e19f"},{"name":"merge-group-unit-tests","sha256":"1805521fe777fb7f199c8f0cee70f3b6b0ff2c5851082586adcc6f0f87bfc0e6"},{"name":"merge-group-architecture-tests","sha256":"ee4b0d4a6d88ecbc5bebdc3aca75ce648600fad1b325a21564fa2544020a115a"},{"name":"roadmap-work-candidate-manifest","sha256":"59a27cdb7b8cf12762b25e45e74be44f47deb8cffff6b732ea2d76038c41d88c"},{"name":"roadmap-work-Q3-gate-results","sha256":"b77d6856c76269477ec4f070bbd71e7e4d0dc153e6660eedc6ecb0c8a1724b13"},{"name":"sdd-verify","sha256":"b68beacd90e58d6d9535274bd0fb751291e817ad4d43056b4827fe97015b0537"},{"name":"sdd-ship-verdict","sha256":"c6e066d3fc3b2d88b2090c70b8784b82634afd5c78cb08b3b3a5f5618ae465f1"},{"name":"schema-v3-milestone-critique-PASS","sha256":"1f932878662302036e70648dd24b9c1dadd23a74085d771991727fa92d69e829"},{"name":"reviewed-head-75373222ccfe50ab73313805f8496edde1dcf482","sha256":"f75ac855f159f46a1d8d99dbcc9a671b30f5f9d183f5003ed614b82db1a7fb48"},{"name":"structured-review-pass-5561944206","sha256":"f880645e3f8ef478051909e8f35d826cc093d609729d54861adb8f8576b7e2c5"},{"name":"structured-review-acceptance-5561981103","sha256":"19514e6ef2975d0b31be7d7e59ab6a4ce9b1ebc02ac7baa680e69683c1f99f22"},{"name":"implementation-merge-9cf69344a84ca45b90a45775e486a0c1e6a2611f","sha256":"7135c7e3602c6691e98b9fa56e5ccf4731905f1d3938ec58331d1f36eb57ebfc"},{"name":"protected-main-codeql-run-34069301386","sha256":"1a83f3a02dca8e525a7020c5f0053d9ee7894210e6c18a47f1df5574446b082c"},{"name":"protected-main-bootstrap-run-34069301634","sha256":"09ccc4b2ee271d5a280883527a29a481368fcd245734810c7efaee553df3f0af"},{"name":"completed-lifecycle-frontier-revision-24","sha256":"9a7cb7b09696f9569a3e6ea972dbceeb7adbdb99434e1f487311b8d01f1fb650"},{"name":"synthetic-checkpoint-proof","sha256":"4b49aacf93960dfd4bf865715e2318e35670548131540906747113e9d1c607c1"},{"name":"synthetic-checkpoint-anchor-revision-18","sha256":"70dbae3361e2f765bf295ead17ba981ad268e57eefd2146eda135e794eaf66d6"}],"acceptedAt":"2026-09-07T00:24:21Z","digest":"dd321136fe28e135ba5ee29a3b81a2041b81c8eb29126762cf893bb98ece34d8"}
